{
  "v": 1,
  "alg": "ed25519",
  "pubkeyB64": "LS0tLS1CRUdJTiBQVUJMSUMgS0VZLS0tLS0KTUNvd0JRWURLMlZ3QXlFQWl3YldWSzl3MjFjVndYTzdPVGs3MXd0d0p4aWFseDU5R0NsMWZ1UEtMbjQ9Ci0tLS0tRU5EIFBVQkxJQyBLRVktLS0tLQo=",
  "fingerprint": "f65a514b49ce2b4bcd646925699d0674b8ef9c294398531f7a00da753fd32efc",
  "sigB64": "78AZuBXDG1BwEIqHKzOnTDV9zjkP7VaGdI0RGxiTyTi2TmsSBoWo2ZYa9akqpEy3K4lWvAAGu79SXb0ZVWgoDw==",
  "signedTs": 1769904000000,
  "signer": {
    "type": "VAULT",
    "attestationLevel": "SOFTWARE"
  }
}
